{
  "project_id": "proj_demo",
  "format": "svg",
  "artifact_path": "artifacts/demo/proj_demo.svg",
  "artifact_sha256": "9e107d9d372bb6826bd81d3542a419d6f8bde8ef7d5b0d9b3af0b84f7f1d43f1",
  "bytes_written": 2048,
  "seed": 7,
  "engine_versions": {
    "occt": "0.0.0",
    "nest": "0.0.0",
    "cam": "0.0.0",
    "wood": "0.0.0",
    "schemas": "0.0.0"
  },
  "revision_id": "rev_local",
  "inputs_hash": "b5d4045c3c9d3c0f1f8b514c1f1f5bac47c0d25f6e4a29e2345f9b1a7b123456"
}
